{
  "format": "dope-kernel-compile-report",
  "version": 3,
  "release_policy": {
    "version": 1,
    "tier": "l3",
    "maximum_artifact_bytes": 10240,
    "require_formal_dp": false
  },
  "release_policy_hash": "2b4bd82cd7f35cf9d334a44f5e670bfc5e56d44e51d2691fd4704ad362ee7b87",
  "task": "regression",
  "rows": 316,
  "positional_features": 3,
  "selected_candidate": "compact_neural_residual_symbolic",
  "artifact_bytes": 528,
  "effective_bytes": 528,
  "bits_per_original_cell": 3.3417721518987342,
  "compliant": false,
  "failed_gates": [
    "utility",
    "driver",
    "production_evidence_unmeasured"
  ],
  "candidate_count": 1,
  "frontier_count": 1,
  "beam_width": 1,
  "elapsed_seconds": 12.566520522,
  "contains_row_payloads": false,
  "contains_row_references": false
}